,Author,Conference,Year,Paper,Editor,City,Edition,Isbn,Dni,Age,Pages,EditorDni,EditorAge
138,Hans Ulrich Simon,MAXsat conference,2019,Models for Reactivity.,Walter J. Savitch,Lleida,edition 2019 MAXsat conference,138106757,59674338,31,4,80309963,24
139,Juha Honkala,UDL conference,2016,"Axioms for Generalized Graphs, Illustrated by a Cantor-Bernstein Proposition.",Delphine Longuet,Balaguer,edition 2016 UDL conference,191837884,78960593,88,18,94536859,52
140,Norbert Blum,UDL conference,2017,A Proof System for Distributed Processes.,Walter J. Savitch,Balaguer,edition 2017 UDL conference,149881177,64277410,27,12,80309963,24
141,Hans Ulrich Simon,MAXsat conference,2019,Finite State Relational Programs.,Walter J. Savitch,Barcelona,edition 2019 MAXsat conference,48323313,59674338,31,7,80309963,24
142,Arnold Schönhage,MAXsat conference,2021,A Gap Between the Actual Complexity of Permutations and Their Entropy Defined by Stoß.,George Leih,Barcelona,edition 2021 MAXsat conference,162701188,61820563,79,13,85593130,43
143,Arnold Schönhage,MAXsat conference,2015,MAT learners for tree series: an abstract data type and two realizations.,George Leih,Barcelona,edition 2015 MAXsat conference,103003256,61820563,79,17,85593130,43
144,Norbert Blum,UDL conference,2017,Exponentially decreasing number of operations in balanced trees.,Karl Meinke,Lleida,edition 2017 UDL conference,117959586,64277410,27,7,91129656,78
145,Norbert Blum,MAXsat conference,2017,Correctness of the Compiling Process Based on Axiomatic Semantics.,George Leih,Madrid,edition 2017 MAXsat conference,103459394,64277410,27,6,85593130,43
146,Nathan Goodman,MAXsat conference,2015,Paramodulated Connection Graphs.,Walter J. Savitch,Balaguer,edition 2015 MAXsat conference,146614209,94763246,58,5,80309963,24
147,Oded Shmueli,MAXsat conference,2015,Paramodulated Connection Graphs.,Walter J. Savitch,Balaguer,edition 2015 MAXsat conference,146614209,66971368,29,5,80309963,24
148,Arnold Schönhage,MAXsat conference,2016,The Lattice of Data Refinement.,Karl Meinke,Lleida,edition 2016 MAXsat conference,102689233,61820563,79,15,91129656,78
149,Sanjeev Saxena,MAXsat conference,2015,Backtracking in Recursive Computations.,George Leih,Balaguer,edition 2015 MAXsat conference,85430350,85988832,36,7,85593130,43
150,Hans Ulrich Simon,UDL conference,2016,A first step in characterizing three-element codes.,Walter J. Savitch,London,edition 2016 UDL conference,68149526,59674338,31,12,80309963,24
151,Sanjeev Saxena,UDL conference,2017,Efficient LL(1) Error Correction and Recovery Using Only Insertions.,Karl Meinke,Barcelona,edition 2017 UDL conference,137751327,85988832,36,16,91129656,78
152,Arnold Schönhage,UDL conference,2017,Formal Derivation of Strongly Correct Concurrent Programs.,Delphine Longuet,Madrid,edition 2017 UDL conference,61327966,61820563,79,13,94536859,52
