,Author,Conference,Year,Paper,Editor,City,Edition,Isbn,Dni,Age,Pages
147,Juha Honkala,UDL conference,2015,MAT learners for tree series: an abstract data type and two realizations.,Delphine Longuet,London,edition 2015 UDL conference,188628364,63860055,87,12
148,Nathan Goodman,UDL conference,2015,Exponentially decreasing number of operations in balanced trees.,Delphine Longuet,Lleida,edition 2015 UDL conference,192632690,63425111,60,10
149,Oded Shmueli,UDL conference,2015,Exponentially decreasing number of operations in balanced trees.,Delphine Longuet,Lleida,edition 2015 UDL conference,192632690,96708194,81,10
150,Norbert Blum,MAXsat conference,2020,Correctness of the Compiling Process Based on Axiomatic Semantics.,Karl Meinke,Barcelona,edition 2020 MAXsat conference,101763102,51902203,43,5
151,Hans Ulrich Simon,MAXsat conference,2018,Paramodulated Connection Graphs.,Walter J. Savitch,Balaguer,edition 2018 MAXsat conference,111176265,53552509,36,16
152,Norbert Blum,UDL conference,2019,The Lattice of Data Refinement.,Delphine Longuet,Barcelona,edition 2019 UDL conference,145800794,51902203,43,6
153,Juha Honkala,MAXsat conference,2017,Backtracking in Recursive Computations.,Walter J. Savitch,Lleida,edition 2017 MAXsat conference,105619679,63860055,87,5
154,Norbert Blum,MAXsat conference,2019,A first step in characterizing three-element codes.,Walter J. Savitch,Barcelona,edition 2019 MAXsat conference,97536816,51902203,43,15
155,Norbert Blum,UDL conference,2016,Efficient LL(1) Error Correction and Recovery Using Only Insertions.,Karl Meinke,Madrid,edition 2016 UDL conference,196257311,51902203,43,11
156,Norbert Blum,MAXsat conference,2018,Formal Derivation of Strongly Correct Concurrent Programs.,Karl Meinke,Balaguer,edition 2018 MAXsat conference,77273145,51902203,43,13
